{
  "$schema": "https://json-schema.org/draft/2020-12/schema",
  "type": "object",
  "additionalProperties": false,
  "required": [
    "schema_version",
    "status",
    "input_sha256",
    "decisions_sha256",
    "decision_schema_sha256",
    "reviewer_id",
    "review_session_id",
    "scene_rows",
    "crop_rows",
    "identity_claims"
  ],
  "properties": {
    "schema_version": {
      "const": "ground_originals_independent_review_decision_seal_v1.0.0"
    },
    "status": { "const": "sealed_external_independent_decisions" },
    "input_sha256": {
      "const": "c263eef97d3cd1662954a50748b3f9fadab5cf65ff79ac33ba80b909969699b3"
    },
    "decisions_sha256": {
      "const": "32d85f7815a2ef583e36e988ed330347198db056de04f3fa60bd4e42414c536f"
    },
    "decision_schema_sha256": {
      "const": "5adfebc77bd774afe4ce1a1b70264e3ef1869956408cd4ddc21035fac75adc94"
    },
    "reviewer_id": { "const": "independent-reviewer-pixel-ocr-v1" },
    "review_session_id": { "const": "independent-session-20260713-ground-v1" },
    "scene_rows": { "const": 6 },
    "crop_rows": { "const": 2 },
    "identity_claims": { "const": 0 }
  }
}
