{"crop_rows":2,"decision_schema_sha256":"5adfebc77bd774afe4ce1a1b70264e3ef1869956408cd4ddc21035fac75adc94","decisions_sha256":"32d85f7815a2ef583e36e988ed330347198db056de04f3fa60bd4e42414c536f","identity_claims":0,"input_sha256":"c263eef97d3cd1662954a50748b3f9fadab5cf65ff79ac33ba80b909969699b3","review_session_id":"independent-session-20260713-ground-v1","reviewer_id":"independent-reviewer-pixel-ocr-v1","scene_rows":6,"schema_version":"ground_originals_independent_review_decision_seal_v1.0.0","status":"sealed_external_independent_decisions"}
